{
  "version": "2.1",
  "canvas": {
    "width": 960,
    "height": 540,
    "fps": 12,
    "duration": 13.0,
    "grain_seed": 68,
    "default_transition": {
      "type": "crossfade",
      "duration": 0.7
    }
  },
  "theme": {},
  "scenes": [
    {
      "id": "not-a-table",
      "start": 0,
      "duration": 6.5,
      "elements": [
        {
          "type": "text",
          "text": "AI 动画生产流程",
          "rect": {
            "x": "9%",
            "y": "5%",
            "w": "82%",
            "h": "13%"
          },
          "style": {
            "size": 41
          },
          "animations": [
            {
              "type": "fade",
              "start": 0.05,
              "duration": 0.5
            },
            {
              "type": "slide",
              "start": 0.05,
              "duration": 0.55,
              "from_y": -14
            }
          ]
        },
        {
          "id": "flow-cards",
          "type": "row",
          "rect": {
            "x": "6%",
            "y": "28%",
            "w": "88%",
            "h": "25%"
          },
          "gap": 9,
          "weights": [
            2.3,
            0.48,
            2.3,
            0.48,
            2.3
          ],
          "children": [
            {
              "type": "card",
              "text": "① 文案分析",
              "style": {
                "fill": "$cream",
                "size": 26,
                "stroke": "$red",
                "stroke_width": 3
              },
              "animations": [
                {
                  "type": "pop",
                  "start": 0.65,
                  "duration": 0.53
                }
              ]
            },
            {
              "type": "arrow",
              "style": {
                "stroke": "$red",
                "stroke_width": 3
              },
              "animations": [
                {
                  "type": "draw",
                  "start": 1.18,
                  "duration": 0.38
                }
              ]
            },
            {
              "type": "card",
              "text": "② 自动分镜",
              "style": {
                "fill": "$cream",
                "size": 26,
                "stroke": "$red",
                "stroke_width": 3
              },
              "animations": [
                {
                  "type": "pop",
                  "start": 1.45,
                  "duration": 0.53
                }
              ]
            },
            {
              "type": "arrow",
              "style": {
                "stroke": "$red",
                "stroke_width": 3
              },
              "animations": [
                {
                  "type": "draw",
                  "start": 2.05,
                  "duration": 0.38
                }
              ]
            },
            {
              "type": "card",
              "text": "③ 程序渲染",
              "style": {
                "fill": "$cream",
                "size": 26,
                "stroke": "$red",
                "stroke_width": 3
              },
              "animations": [
                {
                  "type": "pop",
                  "start": 2.22,
                  "duration": 0.53
                }
              ]
            }
          ]
        },
        {
          "type": "timeline",
          "rect": {
            "x": "8%",
            "y": "63%",
            "w": "84%",
            "h": "24%"
          },
          "items": [
            {
              "label": "输入",
              "detail": "脚本"
            },
            {
              "label": "理解",
              "detail": "结构"
            },
            {
              "label": "编排",
              "detail": "时间轴"
            },
            {
              "label": "导出",
              "detail": "MP4"
            }
          ],
          "line_start": 2.55,
          "line_duration": 0.72,
          "items_start": 3.05,
          "stagger": 0.3,
          "style": {
            "stroke": "$red",
            "dot_fill": "$gold",
            "color": "$ink"
          }
        },
        {
          "type": "text",
          "text": "横向布局、连接箭头与时间轴均由 JSON 声明",
          "rect": {
            "x": "7%",
            "y": "92%",
            "w": "86%",
            "h": "6%"
          },
          "style": {
            "color": "$muted",
            "size": 18
          },
          "animations": [
            {
              "type": "fade",
              "start": 4.35,
              "duration": 0.6
            }
          ]
        }
      ]
    },
    {
      "id": "data-table",
      "start": 6.5,
      "duration": 6.5,
      "elements": [
        {
          "id": "head",
          "type": "text",
          "text": "信息图组件 · 四列五行",
          "rect": {
            "x": "7%",
            "y": "4%",
            "w": "86%",
            "h": "12%"
          },
          "style": {
            "size": 37,
            "color": "$ink"
          },
          "animations": [
            {
              "type": "fade",
              "start": 0.05,
              "duration": 0.55
            },
            {
              "type": "slide",
              "start": 0.05,
              "duration": 0.65,
              "from_y": -17
            }
          ]
        },
        {
          "id": "rule",
          "type": "line",
          "rect": {
            "x": "10%",
            "y": "19%",
            "w": "80%",
            "h": 0
          },
          "style": {
            "stroke": "$red",
            "stroke_width": 3
          },
          "animations": [
            {
              "type": "draw",
              "start": 0.25,
              "duration": 0.65
            }
          ]
        },
        {
          "id": "dynamic-table",
          "type": "table",
          "rect": {
            "x": "8%",
            "y": "24%",
            "w": "84%",
            "h": "61%"
          },
          "columns": [
            "功能",
            "输入",
            "动画",
            "输出"
          ],
          "rows": [
            [
              {
                "type": "badge",
                "text": "标题"
              },
              "文字",
              "淡入上移",
              "主标题"
            ],
            [
              {
                "type": "badge",
                "text": "线条"
              },
              "图形坐标",
              "逐笔绘制",
              "表格 / 连线"
            ],
            [
              {
                "type": "badge",
                "text": "图标"
              },
              "矢量素材",
              "弹性缩放",
              "图标节点"
            ],
            [
              {
                "type": "badge",
                "text": "流程"
              },
              "步骤数组",
              "交错进入",
              "动画序列"
            ]
          ],
          "column_weights": [
            1,
            1.1,
            1.15,
            1.25
          ],
          "header_ratio": 0.83,
          "grid_start": 0.55,
          "grid_duration": 0.65,
          "cells_start": 1.12,
          "cell_duration": 0.32,
          "stagger": 0.12,
          "style": {
            "stroke": "$red",
            "stroke_width": 2,
            "font_size": 22,
            "color": "$ink",
            "header_fill": "$red"
          }
        },
        {
          "id": "footer",
          "type": "text",
          "text": "布局自动计算  ·  行列可由 AI 任意指定",
          "rect": {
            "x": "9%",
            "y": "90%",
            "w": "82%",
            "h": "6%"
          },
          "style": {
            "size": 19,
            "color": "$muted"
          },
          "animations": [
            {
              "type": "fade",
              "start": 3.5,
              "duration": 0.65
            }
          ]
        }
      ],
      "transition_in": {
        "type": "wipe_left",
        "duration": 1.0
      }
    }
  ],
  "narration": {
    "segments": [
      {
        "id": "intro",
        "scene_index": 0,
        "offset": 0.6,
        "text": "这是一个由程序生成的信息图动画。",
        "pause_after": 0.3
      },
      {
        "id": "second",
        "scene_index": 1,
        "offset": 0.8,
        "text": "表格可以自由改变行数和列数。",
        "pause_after": 0.2
      }
    ]
  },
  "claims": []
}